"DESCRIPTION","DURATION IN MS","NAME","PARENT SUITE","START TIME","STATUS","STOP TIME","SUB SUITE","SUITE","TEST CLASS","TEST METHOD"
"","1","Błąd: Brak uprawnień do lekcji premium","","2026-06-13","passed","2026-06-13","TestCourseFlow","test_102_meta_reporting","",""
"","1","Załączanie pliku tekstowego (Logi)","","2026-06-13","passed","2026-06-13","TestVisualEvidence","test_103_attachments","",""
"Ten test ma celowo pokazać, jak Allure raportuje błędy.","2","Test Przykładowego Błędu","","2026-06-13","failed","2026-06-13","TestAllureSetup","Blok 10: Raportowanie i Automatyzacja","",""
"","3","Test ze zrzutem ekranu (Symulacja)","","2026-06-13","failed","2026-06-13","TestVisualEvidence","test_103_attachments","",""
"","2","Weryfikacja ładowania lekcji w Bloku 10","","2026-06-13","passed","2026-06-13","TestCourseFlow","test_102_meta_reporting","",""
"Sprawdza, czy skrypt widzi API oraz Dockerowe Appium (port 4723).","158","Weryfikacja Mostu Hybrydowego","","2026-06-13","passed","2026-06-13","TestAllureSetup","Blok 10: Raportowanie i Automatyzacja","",""
